StudentText,LikedCourses
"I am interested in courses like Engineering Materials I, Introduction to Electronic Design Automation Algorithms and Techniques. I am not interested in business courses.",MCG 2360;ELG 6342
I am interested in courses like Adaptive Signal Processing.,ELG 6160
I am interested in courses like Masonry Behavior and Design. I would rather avoid purely theoretical classes.,CVG 7138
I enjoy Theory of Viscous Flows.,MCG 5301;CVG 5184
I am interested in courses like Introduction to Microfluidics.,MCG 4112
I enjoy Mechanics of Materials II.,CVG 3141
"I am interested in courses like Introduction to Medical Imaging Principles and Technology, Principles of Digital Communication.",BMG 5106;ELG 6154
I enjoy studying areas such as Advanced Concrete Technology. I am not interested in business courses.,CVG 5150
"I am interested in courses like VLSI Design Project, Multivariable Digital Control.",ELG 6385;MCG 5185
I enjoy Space Mission Analysis and Design.,MCG 5121
I enjoy Nonlinear Electronic Circuits.,ELG 6389;CHG 8132
I enjoy Chemical Engineering Laboratory.,CHG 4116;ELG 5374
I enjoy Asic's in Telecommunications.,ELG 6378;ELG 4125
I enjoy Planning and Design of Computer Networks.,ELG 5137
"I like Probability, Statistics, Stochastic Processes and Statistical Inference in Engineering. I am not looking for mechanical engineering topics.",CVG 7114
I enjoy studying areas such as Linear Systems.,ELG 4156
"I enjoy studying areas such as Computer Communication, Advanced Concrete Technology.",ELG 6121;CVG 4172
"I am interested in courses like Data Collection and Interpretation, Robot Mechanics.",CHG 3337;MCG 4132
I enjoy Surface Controlled Semiconductor Devices.,ELG 6382;CVG 4130
I enjoy advanced Foundation Engineering.,CVG 7105;CVG 7126
"I am interested in courses like Introduction to Polymer Reaction Engineering, Hydraulic Structures.",CHG 8187;CVG 5111
"I am interested in courses like Engineering Materials II, Data Collection and Interpretation.",MCG 2361;CHG 3337
I like Sustainable Building Design.,CVG 4147
I like Uncertainty Evaluation in Engineering Measurements and Machine Learning.,ELG 5218
I like Integrated Database and Cloud Systems.,ELG 6173
"I enjoy studying areas such as Road Safety Analysis, Renewable Fuels.",CVG 7110;CHG 8301
I am interested in courses like Digital Signal Processing.,ELG 6162
"I am interested in courses like Graphical Models, Interfacial Phenomena in Engineering.",ELG 5131;CHG 8196
I am interested in courses like Advanced Transport Phenomena. I am not looking for mechanical engineering topics.,CHG 8116
"I am interested in courses like Fire Modelling, Durability of Concrete Structures. I am not interested in business courses.",CVG 7174;CVG 5312
"I am interested in courses like Gas Turbine Combustion, Electromagnetic Waves Theory and Applications. I would rather avoid purely theoretical classes.",MCG 5344;ELG 5104
I am interested in courses like Earth Retaining Structures. I would rather avoid purely theoretical classes.,CVG 7104
"I enjoy studying areas such as Digital Image Processing, Advanced Dynamics With Applications. I am less interested in software-heavy courses.",CEG 4316;MCG 5107
I like Master's Seminar in Civil Engineering.,CVG 5366
I like Seismic Analysis and Design of Concrete Structures.,CVG 5313
I like Software Quality Assurance. I am not looking for mechanical engineering topics.,SEG 3103
I enjoy Methodologies for Discrete-Event Modeling and Simulation.,ELG 6114
I enjoy Cloud Infrastructure and Technologies. I am not interested in business courses.,ELG 5164
I am interested in courses like Sustainable Electrical Power Systems.,ELG 4126
I am interested in courses like Masonry Behavior and Design.,CVG 7138
"I am interested in courses like Sustainable Electrical Power Systems, Advanced Soil Mechanics.",ELG 4126;CVG 7101
I like Computer Communication Network.,ELG 5374;MCG 5303
I enjoy Electromagnetic Engineering.,ELG 3106;MCG 5361
I enjoy Robot Mechanics.,MCG 4132
I enjoy Wind Engineering. I am less interested in software-heavy courses.,CVG 5153
I enjoy Bridge Design.,CVG 5311;CVG 4133
I enjoy Wind Engineering.,CVG 5153
I enjoy Computer Architecture III. I would rather avoid purely theoretical classes.,CEG 4136
I like Computer Communication.,ELG 6121
I enjoy studying areas such as Numerical Methods in Geomechanics. I am not interested in business courses.,CVG 7107
I like Signal Processing Electronics.,ELG 6388;CVG 7175
I like Enterprise Architecture and Models. I am less interested in software-heavy courses.,SEG 4170
"I am interested in courses like High-Speed and Low-Power Vlsi, Estimation and Identification in Dynamics using Data. I am not looking for mechanical engineering topics.",ELG 6381;CVG 5309
I like Climate-Resilient Infrastructures in a Changing Climate.,CVG 5216
I like Heat Transfer Operations. I am not looking for mechanical engineering topics.,CHG 2314
I am interested in courses like Advanced Chemical Engineering Thermodynamics.,CHG 8123
"I enjoy studying areas such as Finite Element Analysis 2, Geotechnical Case Studies.",CVG 7124;CVG 7100
"I am interested in courses like Hydraulics of Water Supply and Sewer Systems, Strategies for Engineering Process Analysis.",CVG 4113;CHG 8157
I am interested in courses like Electromagnetic Engineering.,ELG 3106
I enjoy Biological and Engineering Materials I.,MCG 2141
I like Design of Secure Computer Systems. I am not looking for mechanical engineering topics.,CEG 4399
"I am interested in courses like Guidance, Navigation and Control, Introduction to Control Systems. I am not interested in business courses.",MCG 5354;ELG 3155
I like Bridge Design.,CVG 5311;ELG 6166
I like Advanced Software Design and Reengineering.,SEG 4110;MCG 4151
"I am interested in courses like Incompressible Non-Viscous Flows, Structural Dynamics. I am not interested in business courses.",MCG 5303;CVG 4142
"I enjoy studying areas such as Micro and Nano Systems, People in Fires.",MCG 5120;CVG 7173
I enjoy Applied Machine Learning for Computer Engineering. I would rather avoid purely theoretical classes.,CEG 4195
I am interested in courses like Advanced Timber Design.,CVG 5151
I enjoy Numerical Methods in Geomechanics.,CVG 7107
"I enjoy studying areas such as Highway Geometric Design, Optical Communications Systems.",CVG 7154;ELG 5103
"I enjoy studying areas such as Physical/Chemical Unit Operation of Water and Wastewater Treatment, Field Investigations and Environmental Impact Assessment of Civil Engineering Projects. I am not interested in business courses.",CVG 3132;CVG 4175
"I enjoy studying areas such as Advanced Chemical Engineering Thermodynamics, High-Performance Parallel Scientific Computing.",CHG 8123;MCG 5148
I am interested in courses like Adsorption Separation Processes. I am not looking for mechanical engineering topics.,CHG 8132
I enjoy Highway Geometric Design. I am not interested in business courses.,CVG 7154;MCG 3305
I enjoy Operating System Methods for Real-Time Applications.,ELG 6171
I like Plant Design Project (6 units).,CHG 4244;CEG 4316
"I am interested in courses like Fire Behaviour of Materials, Electronics for Mechanical Engineers.",CVG 5320;ELG 3336
I like Algebraic Coding Theory.,ELG 6120
I enjoy Deep Learning and Reinforcement Learning.,ELG 5214
I like Fundamentals and Applications of Chemical Engineering Thermodynamics.,CHG 3324
I like Theory of Plates and Shells.,MCG 5104
I like Introduction to Communication Systems.,ELG 3175
"I enjoy Multimedia Compression, Scalability, and Adaptation.",ELG 6304
I am interested in courses like Control Systems.,MCG 3307
"I enjoy studying areas such as Urban Transportation, Numerical Modelling in Civil Engineering.",CVG 7153;CVG 2181
"I am interested in courses like Physical/Chemical Unit Operation of Water and Wastewater Treatment, Turbomachinery.",CVG 3132;MCG 5341
I am interested in courses like Advanced Software Design and Reengineering.,SEG 4110
I like Thesis (Part 2 of 2) (6 units). I would rather avoid purely theoretical classes.,MCG 2202;MCG 3143
I like Continuum Mechanics.,MCG 5105;ELG 6358
I am interested in courses like Road Safety Analysis.,CVG 7110
I enjoy Micro and Nano Systems.,MCG 5120
I like Cloud Systems and Networks.,SEG 4135
I like Cross Layer Design for Wireless Networks. I am less interested in software-heavy courses.,ELG 6318;CVG 5333
I am interested in courses like Membranes in Clean Processes.,CHG 8192
"I enjoy studying areas such as Finite Element Methods I, Biomechanics of Movement.",CVG 5156;BMG 5120
I enjoy studying areas such as Surface Controlled Semiconductor Devices.,ELG 6382
I like Biopharmaceutics and Fermentation.,CHG 8306
I like Data Encryption.,ELG 5373
"I enjoy studying areas such as Software Design and Architecture, Clinical Engineering.",SEG 3102;BMG 5113
I like Finite Element Methods II. I prefer not to take unrelated subjects.,CVG 5157
I am interested in courses like Biological Signals.,ELG 6307
I enjoy Mobile Robotics. I prefer not to take unrelated subjects.,ELG 5228;CVG 7158
I am interested in courses like Theory of Viscous Flows.,MCG 5301
I enjoy studying areas such as Fibre and Waveguide Components for Communications and Sensors.,ELG 6371
I enjoy Characterization Methods for Materials.,CVG 5192;ELG 5386
I enjoy Finite Element Methods II.,CVG 5157
I like River Hydraulics. I am less interested in software-heavy courses.,CVG 5162;ELG 6372
I like Membranes in Clean Processes. I am less interested in software-heavy courses.,CHG 8192;ELG 5131
I enjoy studying areas such as Rock Mechanics.,CVG 5187
I am interested in courses like Electronics I.,ELG 2136
I enjoy Real-Time Systems Design.,CEG 4166;CHG 8304
"I enjoy studying areas such as VLSI Design Project, Engineering Materials II.",ELG 6385;MCG 2361
"I am interested in courses like Optical Communications Systems, Fluid Mechanics II. I am not looking for mechanical engineering topics.",ELG 5103;MCG 3341
I am interested in courses like Seismic Analysis and Design of Concrete Structures.,CVG 5313
I enjoy Research Methods for Engineers. I prefer not to take unrelated subjects.,ELG 6322
I like Geotechnical Earthquake Engineering.,CVG 7109
I enjoy Methodologies for Discrete-Event Modeling and Simulation.,ELG 6114
I am interested in courses like Advanced Dynamics With Applications. I am less interested in software-heavy courses.,MCG 5107
I like Nuclear Engineering. I prefer not to take unrelated subjects.,MCG 5322;CVG 7112
I am interested in courses like Optical Communications Systems.,ELG 5103
I like Introduction to Software Engineering.,SEG 2105;CVG 7104
I enjoy Theory of Viscous Flows.,MCG 5301;SEG 3125
I am interested in courses like Plant Design Project (9 units). I am not looking for mechanical engineering topics.,CHG 4250
"I enjoy studying areas such as Biological Signals, Theory of Plates and Shells.",BMG 5104;MCG 5104
I am interested in courses like Performance and Economics of V/Stol Aircraft.,MCG 5310
"I am interested in courses like 3D Machine Vision: From Robots to the Space Station, System Dynamics.",MCG 5328;MCG 3306
I enjoy Submicron Cmos and Bicmos Circuits for Sampled Data Applications.,ELG 6376;BMG 5301
"I enjoy studying areas such as Virtual Environments, Fluid Machinery.",ELG 5124;MCG 4110
I like Non-Linear Discontinuous Dynamics and Control. I am not looking for mechanical engineering topics.,MCG 5186;ELG 6171
I enjoy Theory Semiconductor Devices.,ELG 6380;MCG 4328
I like Software Design and Architecture. I am not looking for mechanical engineering topics.,SEG 3102
I like Methods of Energy Conversion.,MCG 5321;ELG 6101
I like Source Coding and Data Compression.,ELG 6167
I enjoy Fundamentals of Fluid Dynamics. I am not looking for mechanical engineering topics.,MCG 5300
"I enjoy studying areas such as Design of Secure Computer Systems, Heat Transfer by Convection. I am not looking for mechanical engineering topics.",CEG 4399;MCG 5132
I like Instrumentation Techniques.,MCG 5332;CVG 2107
"I am interested in courses like Performance-Based Earthquake Engineering, Geotechnical Hazards. I am not looking for mechanical engineering topics.",CVG 7181;CVG 5314
I enjoy studying areas such as Non-Equilibrium Gas Dynamics.,MCG 5149
I enjoy Statistical Thermodynamics. I would rather avoid purely theoretical classes.,MCG 5141;CVG 5161
I like Finite Element Methods II.,CVG 5157
"I am interested in courses like Fluid Mechanics II, Gas Turbine Combustion.",MCG 3341;MCG 5344
"I am interested in courses like Process Synthesis, Design and Economics.",CHG 3112
I like Gas Turbines. I am not interested in business courses.,MCG 5342
I enjoy Wireless Communication Fundamentals. I am less interested in software-heavy courses.,ELG 4179;CVG 5143
I like Operating System Methods for Real-Time Applications.,ELG 6171
"I enjoy studying areas such as Heat Transfer by Conduction, Electronics II.",MCG 5131;ELG 3136
"I enjoy studying areas such as Resource Management on Distributed Systems, Chemical Engineering Fundamentals.",ELG 6306;CHG 1125
I enjoy studying areas such as Theory Semiconductor Devices.,ELG 6380
"I enjoy studying areas such as Process Synthesis, Design and Economics.",CHG 3112
I am interested in courses like Silicon Photonics.,ELG 6301
I enjoy studying areas such as Digital Systems II. I would rather avoid purely theoretical classes.,CEG 3155
I enjoy studying areas such as Soil Mechanics I.,CVG 3109
"I am interested in courses like Membrane Gas Separation Processes, Computer Communication.",CHG 8198;ELG 6121
"I enjoy studying areas such as Wood structures and fire, Blast Load Effects on Structures.",CVG 7112;CVG 7184
"I am interested in courses like Product Design and Development, Wavelets and Multiresolution Signal Analysis.",MCG 4143;ELG 5370
I enjoy Hydraulics of Open Channels.,CVG 4110;ELG 6360
I enjoy Electronics III. I prefer not to take unrelated subjects.,ELG 4139
"I enjoy Solar Cells - Principles, Materials, Systems and Operation. I would rather avoid purely theoretical classes.",ELG 6397
I enjoy Engineering Acoustics.,MCG 5330
I am interested in courses like Long Span Structures. I would rather avoid purely theoretical classes.,CVG 5159
I enjoy studying areas such as Optoelectronics and Optical Components.,ELG 4117
I enjoy Introduction to Software Engineering. I am not interested in business courses.,SEG 2105;CVG 4107
"I am interested in courses like High-Speed and Low-Power Vlsi, Independent Engineering Study.",ELG 6381;MCG 5398
I enjoy Rehabilitation of Concrete Structures.,CVG 5190
"I enjoy studying areas such as Incompressible Non-Viscous Flows, Advanced Strength of Materials.",MCG 5303;MCG 3145
I like Structural Stability.,CVG 5149;CHG 4250
"I enjoy studying areas such as Advanced Biochemical Engineering, Digital Control Systems. I am not looking for mechanical engineering topics.",CHG 8181;CEG 4140
I enjoy studying areas such as Reliability and Maintainability in Engineering Design.,MCG 4329
I enjoy Advanced Digital Communication.,ELG 5180;MCG 5310
I am interested in courses like Fundamentals and Applications of Chemical Engineering Thermodynamics. I prefer not to take unrelated subjects.,CHG 2324
I enjoy Decentralized Wastewater Management.,CVG 5181;ELG 6354
I enjoy Construction Management.,CVG 4173
I enjoy Digital Signal Processing.,ELG 4177
I like Heat Transfer by Conduction.,MCG 5131
"I enjoy studying areas such as Combustion in Diffusion Systems, Theory of Plates and Shells.",MCG 5192;MCG 5104
"I enjoy studying areas such as Introduction to Microfluidics, Chemical Reaction Engineering.",MCG 4112;CHG 3127
I enjoy studying areas such as Microsensors and Mems. I prefer not to take unrelated subjects.,ELG 6377
I like Robotics.,MCG 5353
I enjoy Inviscid Flow Theory.,MCG 5155
"I am interested in courses like Theory of Structures II, Fluid Mechanics I. I am less interested in software-heavy courses.",CVG 4148;MCG 3340
I like Electric Machines and Power Systems.,ELG 3316
I am interested in courses like Smart Antennas.,ELG 5132
I enjoy Fire Behaviour of Materials.,CVG 5320
I enjoy studying areas such as Optimal Control Systems.,MCG 5352
I enjoy Advanced Chemical Engineering Thermodynamics.,CHG 8123
I enjoy studying areas such as Radio Frequency Integrated Circuit Design.,ELG 6353
I like Systems Engineering and Integration.,MCG 5173;ELG 6174
"I enjoy studying areas such as Software Design and Architecture, Cloud Analytics.",SEG 3102;ELG 5166
I like Finite Element Analysis 1.,CVG 7122
I enjoy Applications in Biomedical Image Processing.,BMG 5107;ELG 6360
"I am interested in courses like Introduction to Microfluidics, Theory of Structures II. I prefer not to take unrelated subjects.",BMG 5319;CVG 4148
I like Chemical Engineering Practice.,CHG 3122
I like Numerical modelling in water resources.,CVG 5112;MCG 4322
"I enjoy studying areas such as Cross Layer Design for Wireless Networks, Construction Equipment Management.",ELG 6318;CVG 5101
I enjoy Distributed Systems Engineering.,ELG 6127
I enjoy Product Design and Development.,MCG 4143
I enjoy Thesis (6 units).,CVG 4260;ELG 6153
I enjoy Numerical Methods in Electromagnetic Engineering.,ELG 5379
I like Climate-Resilient Infrastructures in a Changing Climate.,CVG 5216
I enjoy Reliability and Maintainability in Engineering Design.,MCG 4329