StudentText,LikedCourses
"i am interested in courses like introduction to polymer reaction engineering, medical imaging modalities.",CHG 8187;BMG 5105
i enjoy biofluid mechanics.,MCG 3143
i enjoy telecommunications software design and analysis.,SEG 4156
i like simulation and optimization of electronic circuits. i prefer not to take unrelated subjects.,ELG 6356;MCG 2131
"i am interested in courses like theory semiconductor devices, introduction to software engineering. i prefer not to take unrelated subjects.",ELG 6380;SEG 2105
i like biological and engineering materials.,BMG 5300;CEG 4316
i like silicon photonics.,ELG 6301
i like the internet of things.,ELG 6309
i like uninhabited aircraft systems design.,MCG 5305
i like digital image processing.,CEG 4316
i like engineering acoustics.,MCG 5330;CHG 8161
i am interested in courses like incompressible non-viscous flows. i prefer not to take unrelated subjects.,MCG 5303
i like cloud analytics.,ELG 5166;MCG 5151
i enjoy gas dynamics.,MCG 4325
i like combustion in diffusion systems.,MCG 5192
i like directed studies.,ELG 7199;CVG 7175
i am interested in courses like energy and the critical zone.,CVG 7337
i like turbomachinery.,MCG 5341
i enjoy studying areas such as stability theory and applications.,MCG 5355
i enjoy estimation and identification in dynamics using data. i am not interested in business courses.,CVG 5309;ELG 5166
i am interested in courses like hydraulics of water supply and sewer systems.,CVG 4113
i enjoy nuclear engineering.,MCG 5322
i enjoy studying areas such as biological and engineering materials i. i prefer not to take unrelated subjects.,MCG 2141
"i enjoy studying areas such as space robotics, advanced environmental engineering.",MCG 5329;CVG 4130
i am interested in courses like vlsi design project.,ELG 6385
"i enjoy studying areas such as operating system methods for real-time applications, industrial planning.",ELG 6171;MCG 4130
i like directed studies ii.,CVG 6109;BMG 5105
i am interested in courses like heat transfer by conduction.,MCG 5131
