StudentText,LikedCourses
"i am interested in courses like enterprise architecture and models, clinical engineering. i am not interested in business courses.",SEG 4170;BMG 5113
i enjoy principles of photonics.,ELG 6372;CVG 4142
"i like electric power transmission, distribution and utilization.",ELG 4125
"i am interested in courses like signal integrity in high-speed designs: modeling and analysis, membrane liquid separation processes and materials. i would rather avoid purely theoretical classes.",ELG 6341;CHG 8194
i am interested in courses like planning and design of computer networks.,ELG 5137
"i enjoy studying areas such as structural steel design ii, cross layer design for wireless networks.",CVG 4143;ELG 6318
i like characterization methods for materials. i am not looking for mechanical engineering topics.,CVG 5192
i enjoy building performance simulation.,MCG 5324
i enjoy measurements i (4 units).,CVG 2170
i enjoy studying areas such as advanced strength of materials and applications to biomechanical systems. i am not looking for mechanical engineering topics.,MCG 3141
i like digital control systems.,CEG 4140
i enjoy wastewater treatment principles and design.,CVG 5308
i am interested in courses like computer-aided design in chemical engineering.,CHG 4343
i enjoy numerical methods of structural analysis.,CVG 5146
i like integrated circuit technology. i would rather avoid purely theoretical classes.,ELG 6359
i enjoy studying areas such as deformation and fracture of engineering materials.,MCG 4135
"i am interested in courses like oil and gas processing, transport phenomena.",CHG 4364;CHG 3316
i like gas dynamics.,MCG 4325
i like introduction to electronic commerce. i am not interested in business courses.,SEG 4189
"i enjoy studying areas such as graphical models, reliability and maintainability in engineering design. i am not looking for mechanical engineering topics.",ELG 5131;MCG 4329
i enjoy theory of plates and shells.,MCG 5104
i like stability theory and applications.,MCG 5355
i like masonry behavior and design.,CVG 7138
i like membrane liquid separation processes and materials.,CHG 8194;CVG 5159
i like electric machines and power systems.,ELG 3316
i am interested in courses like fire dynamics i.,CVG 7171
i enjoy geotechnical hazards.,CVG 5314;CVG 7100
"i enjoy studying areas such as mechanics of materials ii, microwave semiconductor devices and applications.",CVG 3141;ELG 6362
"i am interested in courses like designing secure networking and computer systems, measurements i (4 units). i am not interested in business courses.",ELG 6189;CVG 2170
"i am interested in courses like manufacturing, signal processing electronics.",MCG 4328;ELG 6388
i enjoy elements of bridge engineering.,CVG 5158;CVG 7123
"i enjoy studying areas such as statistical thermodynamics, thermodynamics i.",MCG 5141;MCG 2130
i enjoy vlsi design project.,ELG 6385
i enjoy introduction to mobile communications.,ELG 6166;MCG 5350
i like numerical methods and engineering computation in chemical engineering.,CHG 1371;SEG 4170
i am interested in courses like fourier optics.,ELG 6368
i am interested in courses like data encryption. i am not looking for mechanical engineering topics.,ELG 5373
i like long span structures.,CVG 5159
i enjoy studying areas such as civil engineering mechanics.,CVG 2149
"i am interested in courses like electromagnetic fields and biological systems, adsorption separation processes.",BMG 5330;CHG 8132
i enjoy source coding and data compression.,ELG 5126;CVG 3140
"i am interested in courses like building energy systems, theory of plates and shells. i would rather avoid purely theoretical classes.",MCG 4104;MCG 5104
"i enjoy studying areas such as earthquake analysis and design of structures, robotics: control, sensing and intelligence.",CVG 7123;ELG 5161
i enjoy studying areas such as introduction to chemical process analysis and design. i prefer not to take unrelated subjects.,CHG 2317
i enjoy studying areas such as theory of turbulence.,MCG 5152
i enjoy structural assessment of historic buildings.,CVG 7115
"i enjoy studying areas such as directed studies i, electric circuits and machines for mechanical engineering.",CVG 6108;ELG 2336
i enjoy plant design project (6 units).,CHG 4244;MCG 4220
i am interested in courses like biomechanics of movement.,BMG 5120
i enjoy model-driven security engineering.,ELG 6315
"i enjoy studying areas such as design of artificial organs, integrated control systems. i am not interested in business courses.",MCG 4152;ELG 4159
i enjoy studying areas such as nonlinear optimization.,MCG 5115
i enjoy studying areas such as advanced methods for simulation of large-scale circuits and systems.,ELG 6358
i am interested in courses like construction management.,CVG 4173
i enjoy studying areas such as directed studies.,ELG 6196
i enjoy mechanical engineering capstone project: part ii (6 units). i would rather avoid purely theoretical classes.,MCG 3222
"i enjoy studying areas such as advanced building characterization, conservation and rehabilitation.",CVG 7111
i like introduction to composite materials.,MCG 4144
i am interested in courses like advanced linear systems.,ELG 6152
i enjoy studying areas such as neural networks for high-speed /high frequency circuit design.,ELG 6344
"i enjoy studying areas such as designing secure networking and computer systems, guidance, navigation and control.",ELG 6189;MCG 5354
"i am interested in courses like solar cells - principles, materials, systems and operation, advanced software design and reengineering.",ELG 6397;SEG 4110
i am interested in courses like mechatronics.,MCG 4136
i enjoy computer architecture i.,CEG 2136;MCG 5350
i enjoy fundamentals of policy i: policy analysis.,BMG 5130;MCG 5177
i enjoy biological signals.,ELG 6307
i enjoy rf system design.,ELG 6317
i enjoy mechanics of materials i. i am less interested in software-heavy courses.,CVG 2140;CHG 8195
i like people in fires.,CVG 7173;CVG 5150
i like oil and gas processing.,CHG 4364;MCG 2142
i am interested in courses like finite element analysis 2.,CVG 7124
"i am interested in courses like mechanics of materials ii, computer architecture iii.",CVG 3141;CEG 4136
i like communication systems. i am not interested in business courses.,ELG 4176;MCG 4142
"i am interested in courses like water resources management, resource management on distributed systems.",CVG 5182;ELG 6306
"i am interested in courses like geotechnical materials and processes, instrumentation techniques. i am not looking for mechanical engineering topics.",CVG 2107;MCG 5332
"i enjoy studying areas such as real-time systems design, micro and nano systems.",CEG 4166;MCG 5120
"i am interested in courses like computer-aided design in chemical engineering, design of medical devices and implants.",CHG 4343;BMG 5311
i like robot design and control.,MCG 4134
i enjoy modern control engineering.,ELG 4157;MCG 5310
i am interested in courses like circuit theory i.,ELG 2138
"i enjoy studying areas such as geotechnical design, advanced strength of materials and applications to biomechanical systems.",CVG 4108;MCG 3141
i like introduction to microfluidics.,BMG 5319;ELG 6306
i like adaptive and learning systems.,ELG 6141
i am interested in courses like process risk management and sustainability.,CHG 4307
i enjoy studying areas such as electronics i. i am not interested in business courses.,ELG 2136
i enjoy studying areas such as advanced methods for simulation of large-scale circuits and systems.,ELG 6358
"i enjoy studying areas such as mechanics of materials ii, finite element analysis.",CVG 3141;MCG 4102
i am interested in courses like geotechnical design. i prefer not to take unrelated subjects.,CVG 4108
i like advanced digital communication.,ELG 6165
i enjoy studying areas such as system dynamics.,MCG 3306
"i am interested in courses like electric power transmission, distribution and utilization, measurement in fluid mechanics.",ELG 4125;MCG 5156
i enjoy studying areas such as decentralized wastewater management.,CVG 5181
i am interested in courses like electrochemical engineering.,CHG 8300
i enjoy electric machines and power systems.,ELG 3316
"i am interested in courses like adaptive signal processing, methods of energy conversion. i prefer not to take unrelated subjects.",ELG 5377;MCG 5321
"i am interested in courses like modern control engineering, chemical engineering laboratory. i am less interested in software-heavy courses.",ELG 4157;CHG 4116
i am interested in courses like thesis (part 1 of 2). i prefer not to take unrelated subjects.,MCG 2201
i like interactive networked systems & telemedicine.,ELG 6393
i am interested in courses like fundamentals of policy i: policy analysis.,BMG 5130
i like digital signal processing. i am not looking for mechanical engineering topics.,ELG 5376;CHG 3324
i enjoy fluid machinery. i prefer not to take unrelated subjects.,MCG 4110;MCG 4322
i like radar systems. i prefer not to take unrelated subjects.,ELG 6364;ELG 5376
"i enjoy studying areas such as biocontrol systems, directed studies ii. i am not looking for mechanical engineering topics.",MCG 3142;CVG 6109
i enjoy studying areas such as robotics. i would rather avoid purely theoretical classes.,MCG 5353
i like introduction to control systems.,ELG 3155;CVG 5143
i enjoy surface controlled semiconductor devices. i would rather avoid purely theoretical classes.,ELG 6382
i enjoy earth retaining structures.,CVG 7104;CVG 5124
i enjoy construction life cycle analysis.,CVG 5185
i enjoy process control.,CHG 3335;ELG 5379
"i like advanced building characterization, conservation and rehabilitation.",CVG 7111
i enjoy studying areas such as creative problem solving and design. i prefer not to take unrelated subjects.,MCG 5361
i enjoy studying areas such as surface controlled semiconductor devices.,ELG 6382
"i am interested in courses like fibre and waveguide components for communications and sensors, building energy systems.",ELG 6371;MCG 4104
i enjoy studying areas such as finite element analysis i.,MCG 5365
i like membrane liquid separation processes and materials.,CHG 8194;CVG 5189
"i am interested in courses like plant design project (6 units), advanced reinforced concrete.",CHG 4244;CVG 5144
i enjoy research methodology and communication.,CHG 8333;CVG 5313
i enjoy studying areas such as numerical modelling in civil engineering.,CVG 2181
i enjoy studying areas such as introduction to electronic commerce. i am not looking for mechanical engineering topics.,SEG 4189
i enjoy ubiquitous sensing for smart cities. i am not interested in business courses.,ELG 5142
i like computer systems design. i am not looking for mechanical engineering topics.,CEG 3156
"i am interested in courses like theory of structures i, manufacturing.",CVG 3140;MCG 4328
i like ai-enabled wireless networks.,ELG 5143
"i am interested in courses like building performance simulation, earthquake analysis and design of structures. i am not looking for mechanical engineering topics.",MCG 5324;CVG 7123
i like circuit theory i.,ELG 2138;MCG 4132
i am interested in courses like rock mechanics.,CVG 5187
i like asic's in telecommunications. i am less interested in software-heavy courses.,ELG 6378
i enjoy studying areas such as road safety analysis.,CVG 7110
i enjoy computer communication.,ELG 6121;MCG 5184
i am interested in courses like bioinstrumentation.,MCG 4150
i like advanced methods for simulation of large-scale circuits and systems.,ELG 6358;CVG 2116
i like electric machines and power systems.,ELG 3316;MCG 5483
"i am interested in courses like structural stability, structural steel design ii.",CVG 5149;CVG 4143
i like optoelectronics and optical components.,ELG 4117;CEG 4140
i enjoy nuclear engineering.,MCG 5322;MCG 5328
"i enjoy studying areas such as model-driven security engineering, digital control systems.",ELG 6315;CEG 4140
i like thesis (part 1 of 2). i am not interested in business courses.,MCG 2201;MCG 3306
i am interested in courses like field investigations and environmental impact assessment of civil engineering projects.,CVG 4175
i am interested in courses like micro and nano systems. i would rather avoid purely theoretical classes.,MCG 4137
i like introduction to composite materials. i prefer not to take unrelated subjects.,MCG 4144;ELG 6127
i enjoy studying areas such as applications in biomedical image processing.,BMG 5107
i enjoy studying areas such as model-driven development of real-time and distributed software.,ELG 6178
"i am interested in courses like fire modelling, introduction to electronic design automation algorithms and techniques.",CVG 7174;ELG 6342
i like nuclear engineering. i would rather avoid purely theoretical classes.,MCG 5322;CVG 5154
i like incompressible non-viscous flows.,MCG 5303
"i am interested in courses like software design and architecture, planning and design of computer networks.",SEG 3102;ELG 5137
i enjoy directed studies.,ELG 7199
i am interested in courses like nuclear engineering.,MCG 5322
i enjoy studying areas such as advanced strength of materials.,MCG 3145
i like communication systems.,ELG 4176
i enjoy directed studies.,ELG 7199
i like deformation and fracture of engineering materials.,MCG 4135
i enjoy studying areas such as uncertainty evaluation in engineering measurements and machine learning.,ELG 5218
i enjoy studying areas such as real time and embedded software design.,SEG 4145
i like algebraic coding theory.,ELG 6120
"i enjoy studying areas such as river hydraulics, fundamentals of fire safety engineering.",CVG 5162;CVG 7170
"i enjoy studying areas such as introduction to fluid mechanics, structural steel design ii.",CVG 2116;CVG 4143
i enjoy earthquake engineering. i am not looking for mechanical engineering topics.,CVG 5155;CHG 2312
i like software engineering project management.,ELG 5100
i like directed studies.,ELG 7199;MCG 5147
i like thesis (6 units). i am not interested in business courses.,CVG 4260;MCG 5355
"i am interested in courses like introduction to polymer reaction engineering, higher layer network protocols.",CHG 8187;CEG 4188
i enjoy studying areas such as modern control engineering. i am not looking for mechanical engineering topics.,ELG 4157
i like microwave and millimeterwave integrated circuits.,ELG 6349
i like advanced materials in chemical engineering.,CHG 4305;MCG 5483
i enjoy advanced steel structures.,CVG 7126
i am interested in courses like computational methods in mechanical engineering.,MCG 4127
i enjoy interactive networked systems & telemedicine. i am not looking for mechanical engineering topics.,ELG 6393
i enjoy studying areas such as heat transfer by radiation.,MCG 5133
i am interested in courses like product design and development.,MCG 4143
i like information theory.,ELG 5170;CVG 5190
i enjoy neural networks and fuzzy systems.,ELG 5386
i enjoy mechanical engineering capstone project: part i.,MCG 3221
i enjoy earthquake analysis and design of structures.,CVG 7123;CHG 8113
i like deep learning and reinforcement learning.,ELG 5214
i enjoy fire modelling.,CVG 7174
i enjoy asic's in telecommunications.,ELG 6378
i enjoy directed studies.,ELG 7199
i enjoy biomedical system dynamics.,MCG 3305
"i enjoy studying areas such as project information management, inviscid flow theory. i am not looking for mechanical engineering topics.",CVG 5186;MCG 5155
i like thesis (6 units).,MCG 4100;MCG 4153
"i am interested in courses like computer communication network, uncertainty evaluation in engineering measurements and machine learning. i would rather avoid purely theoretical classes.",ELG 5374;ELG 5218
i enjoy digital signal processing.,ELG 5376
"i am interested in courses like digital communications, elements of bridge engineering.",ELG 5375;CVG 5158
i like biomaterials and tissue engineering: theories and applications. i would rather avoid purely theoretical classes.,BMG 5122
i like cross layer design for wireless networks. i am not looking for mechanical engineering topics.,ELG 6318;SEG 4110
"i am interested in courses like transport phenomena, signal and system analysis. i prefer not to take unrelated subjects.",CHG 3316;ELG 3125
i enjoy studying areas such as internal combustion engines. i am not looking for mechanical engineering topics.,MCG 4111
"i am interested in courses like research methodology and communication, compressible non-viscous flows. i am not interested in business courses.",CHG 8333;MCG 5304
i enjoy phase-locked loops and receiver synchronizers.,ELG 6366;ELG 5377
"i am interested in courses like electronics i, real time and embedded software design.",ELG 2136;SEG 4145
i enjoy studying areas such as computational methods in fluid and heat transfer.,MCG 4139
i like ground transportation systems and vehicles.,MCG 5314;CHG 8123
i like adsorption separations for environmental applications.,CHG 4385;CVG 5311
i enjoy studying areas such as software quality assurance. i am not interested in business courses.,SEG 3103
i enjoy software construction. i am not looking for mechanical engineering topics.,SEG 2106
i enjoy gas turbine combustion.,MCG 5344;CVG 2171
i enjoy electromagnetic fields and biological systems. i prefer not to take unrelated subjects.,BMG 5330;MCG 5115
"i enjoy studying areas such as wireless networks, advanced structural dynamics.",CEG 4186;CVG 5142
i enjoy digital communications.,ELG 5375
"i enjoy studying areas such as mobile robotics, process control.",ELG 5228;CHG 3335
i enjoy studying areas such as cross layer design for wireless networks.,ELG 6318
"i am interested in courses like fluid mechanics i, fundamentals of antenna engineering.",MCG 3340;ELG 6367
i enjoy introduction to biomaterials and tissue engineering. i am not looking for mechanical engineering topics.,MCG 4154
"i like guidance, navigation and control. i would rather avoid purely theoretical classes.",MCG 5354;ELG 6356
i enjoy studying areas such as advanced concrete technology.,CVG 5150
i like rock mechanics.,CVG 4107;ELG 4139
i like characterization methods for materials.,CVG 5192;ELG 2336
i am interested in courses like high-performance parallel scientific computing.,MCG 5148
i enjoy finite element analysis 1.,CVG 7122;CVG 7175
"i enjoy studying areas such as independent engineering study, advanced reinforced concrete.",MCG 5398;CVG 5144
"i am interested in courses like virtual environments, advanced digital communication.",ELG 5124;ELG 5180
"i am interested in courses like dynamics of structures, interactive networked systems and telemedicine. i am less interested in software-heavy courses.",CVG 7137;BMG 5304
i like multimedia communications.,ELG 5121;ELG 5375
i enjoy studying areas such as integrated database and cloud systems.,ELG 6173
"i am interested in courses like wireless communication systems engineering, internal combustion engines.",ELG 6168;MCG 4111
i enjoy finite element methods ii.,CVG 5157;CVG 3109
i enjoy pavement and materials.,CVG 7103;ELG 6349
"i am interested in courses like estimation and identification in dynamics using data, introduction to electronic design automation algorithms and techniques. i prefer not to take unrelated subjects.",CVG 5309;ELG 6342
i enjoy studying areas such as engineering materials i.,MCG 2360
"i enjoy studying areas such as creative problem solving and design, mechanical engineering laboratory. i am not interested in business courses.",MCG 5361;MCG 4340
i enjoy gas turbines.,MCG 5342
i enjoy geotechnical materials and processes.,CVG 2107;ELG 4139
i enjoy electronics for mechanical engineers.,ELG 3336
"i enjoy studying areas such as structural stability, adaptive and learning systems. i prefer not to take unrelated subjects.",CVG 5149;ELG 6141
"i am interested in courses like solid mechanics, fundamentals and applications of chemical engineering thermodynamics.",CVG 7120;CHG 3324
"i am interested in courses like sensor fusion for autonomous systems, advanced mechanics of reinforced concrete.",ELG 6312;CVG 7130
i like electronics ii.,ELG 3136
"i enjoy studying areas such as numerical methods in geomechanics, digital watermarking.",CVG 7107;ELG 5360
i am interested in courses like membrane gas separation processes.,CHG 8198
i enjoy studying areas such as civil engineering graphics and seminars.,CVG 1107
i like air pollution control processes.,CHG 4301;ELG 6154
i enjoy biological and engineering materials ii.,MCG 2142;ELG 6393
i like advanced dynamics with applications. i would rather avoid purely theoretical classes.,MCG 5107;MCG 5132
i enjoy medical imaging modalities.,BMG 5105
i like fluid flow.,CHG 2312
i like software project management.,SEG 4105;ELG 2336
"i am interested in courses like fire dynamics ii, advanced steel structures.",CVG 7172;CVG 7126
i am interested in courses like deformation and fracture of engineering materials. i am not looking for mechanical engineering topics.,MCG 4135
i enjoy numerical modelling in civil engineering.,CVG 2181;CEG 4198
"i am interested in courses like finite element analysis 2, micro and nano systems.",CVG 7124;MCG 5120
"i am interested in courses like aerodynamics, introduction to medical imaging principles and technology.",MCG 4345;BMG 5106
i like design of orthopaedic implants and prostheses.,BMG 5312;ELG 6372
i enjoy studying areas such as structural design in timber.,CVG 4146
"i enjoy studying areas such as software quality engineering and management, environmental fluid mechanics relating to energy utilization.",ELG 6115;MCG 5309
"i enjoy studying areas such as introduction to communication systems, environmental biotechnology.",ELG 3175;CHG 4302
i like introduction to mobile communications.,ELG 5133;ELG 6352
"i am interested in courses like sustainable and resilient infrastructure, adsorption separations for environmental applications.",CVG 5214;CHG 4385
i like renewable and distributed energy resource technologies. i would rather avoid purely theoretical classes.,ELG 6302
"i am interested in courses like system modelling, dynamics and control, directed studies.",MCG 5326;ELG 6196
i enjoy non-linear discontinuous dynamics and control.,MCG 5186
i like modern control engineering. i am not looking for mechanical engineering topics.,ELG 4157
i am interested in courses like finite-volume methods for compressible gas flows. i am less interested in software-heavy courses.,MCG 5147
i enjoy biofluid mechanics.,MCG 3143;ELG 6388
"i enjoy studying areas such as random vibration, wave propagation and antennas. i am less interested in software-heavy courses.",CVG 5154;ELG 4118
i like membranes in clean processes. i am less interested in software-heavy courses.,CHG 8192
"i am interested in courses like conductive and radioactive heat transfer, process control.",MCG 5347;CHG 3335
"i am interested in courses like high-performance parallel scientific computing, independent engineering study.",MCG 5148;MCG 5398
i like turbomachinery.,MCG 5341;CVG 7120
"i enjoy studying areas such as hydraulics of open channels, civil engineering graphics and seminars. i am not looking for mechanical engineering topics.",CVG 4110;CVG 1107
"i am interested in courses like thesis (part 1 of 2), advanced thermodynamics. i prefer not to take unrelated subjects.",CVG 2601;MCG 5343
i am interested in courses like research methodology and communication. i prefer not to take unrelated subjects.,CHG 8333
i enjoy methods of energy conversion.,MCG 5321
i enjoy adaptive signal processing.,ELG 6160
i like analysis and design of user interfaces.,SEG 3125;CVG 5187
i enjoy mechanical engineering laboratory.,MCG 4340
i am interested in courses like heat transfer.,MCG 3110
i like mechanics of unsaturated soils.,CVG 4161
i enjoy blast load effects on structures.,CVG 7184;MCG 5303
i like numerical methods of structural analysis. i would rather avoid purely theoretical classes.,CVG 5146;CVG 5320
"i enjoy studying areas such as thesis (6 units), application of mathematical methods to chemical engineering.",CVG 4260;CHG 3331
"i enjoy studying areas such as gas dynamics, construction equipment management.",MCG 4325;CVG 5101
i enjoy digital logic design: principles and practices.,ELG 5195
"i enjoy studying areas such as urban transportation, independent engineering study. i am not looking for mechanical engineering topics.",CVG 7153;MCG 5398
i enjoy introduction to chemical process analysis and design.,CHG 2317;ELG 6377
i am interested in courses like signal processing electronics.,ELG 6388
i like chemical engineering laboratory.,CHG 4116;MCG 4111
i like finite element analysis i. i am not interested in business courses.,MCG 5365
i enjoy simulation and optimization of electronic circuits.,ELG 6356
"i enjoy studying areas such as advanced digital communication, introduction to software engineering.",ELG 5180;SEG 2105
"i am interested in courses like air pollution control processes, elements of bridge engineering.",CHG 4301;CVG 5158
"i am interested in courses like electronics ii, computational methods in fluid and heat transfer. i am less interested in software-heavy courses.",ELG 3136;MCG 4139
i enjoy studying areas such as performance-based earthquake engineering.,CVG 7181
i enjoy reliability and maintainability in engineering design.,MCG 4329;MCG 4154
i am interested in courses like dynamics of structures.,CVG 7137
i like thesis (6 units). i prefer not to take unrelated subjects.,MCG 4100;CVG 7123
"i enjoy studying areas such as optimal control systems, biomaterials: principles and applications.",MCG 5352;CHG 8304
"i am interested in courses like computer network design, adsorption separations for environmental applications. i am not looking for mechanical engineering topics.",CEG 4190;CHG 4385
